{
  "nome_exame": "VR1e2 Biomanguinhos 7500",
  "slug": "vr1e2_biomanguinhos_7500",
  "equipamento": "7500 Real-Time",
  "tipo_placa_analitica": "48",
  "esquema_agrupamento": "96->48",
  "kit_codigo": 1140,
  "alvos": ["SC2", "HMPV", "INF A", "INF B", "ADV", "RSV", "HRV"],
  "mapa_alvos": {
    "SC2": "SC2",
    "SARS-COV-2": "SC2",
    "HMPV": "HMPV",
    "INFA": "INF A",
    "INF A": "INF A",
    "INFB": "INF B",
    "INF B": "INF B",
    "ADV": "ADV",
    "ADENOVIRUS": "ADV",
    "RSV": "RSV",
    "HRV": "HRV"
  },
  "faixas_ct": {
    "detect_max": 38.0,
    "inconc_min": 38.01,
    "inconc_max": 40.0,
    "rp_min": 15.0,
    "rp_max": 35.0
  },
  "rps": ["RP", "RP_1", "RP_2"],
  "export_fields": [
    "Sars-Cov-2",
    "Influenzaa",
    "influenzab",
    "RSV",
    "adenovÃ­rus",
    "metapneumovirus",
    "rinovÃ­rus"
  ],
  "panel_tests_id": "1",
  "controles": {
    "cn": ["G11+G12"],
    "cp": ["H11+H12"]
  },
  "comentarios": "Exame respiratÃ³rio VR1e2; placa 96->48 (pares)"
}
